{"schema_version":"cognitive-runtime.cognitive/v1","cognitive_id":"cog-synthetic-method","entity_type":"epistemic_method","entity_version":1,"title":"Synthetic reliability method","aliases":[],"cognitive_jobs":["evaluate_claim_reliability"],"route_signals":[],"relations":{"governed_by":null,"parent":null,"complements":[],"tensions":[]},"source_refs":["src-synthetic-note"],"confirmed_at":"2026-08-11","updated_at":"2026-08-11"}
